bho,hin,removal_reasons
हिंसा में पुलिस निरीक्षक सुबोध कुमार सिंह आ एगो ग्रामीण के मौत हो गइल.,हिंसा में पुलिस इंस्पेक्टर सुबोध कुमार सिंह और एक ग्रामीण की मौत हो गई,true_duplicate
मोदी कहलन कि उनुका भारतीय जनता पार्टी का अगुआई में चल रहल एनडीए के सरकार पर भरोसा नइखे.,श्री मोदी ने कहा कि वह भारतीय जनता पार्टी के नेतृत्व वाली एनडीए सरकार पर विश्वास नहीं करते,true_duplicate
कहलन कि उद्योगपति लोग कोल्ड स्टोर आ पैकेजिंग क्षेत्र में निवेश कइले बा जवन देश ला अच्छा नइखे.,उन्होंने कहा कि देश के उद्योगपतियों ने कोल्ड स्टोर और पैकेजिंग सेक्टर में निवेश किया है जो देश के लिए अच्छा नहीं है,true_duplicate
आज ई कहे के समय आ गइल बा कि सुराज हमनी के जन्मसिद्ध अधिकार ह आ एकरा के आगे ले जाईं।,आज यह कहने का समय है कि सुराज हमारा जन्मसिद्ध अधिकार है और हम इसे लेकर रहेंगे,true_duplicate
भगवान शिव के नगरी शिव मन्दिर आ शिवालय में लोग जल अभिषेके भगवान शिव के पूजा अर्चना कर रहल बा।,भगवान शिव की नगरी शिव मंदिरों और शिवालयों में लोग जलाभिषेक कर भगवान शिव की पूजा-अर्चना कर रहे हैं,true_duplicate
सुशील चंद्र तिवारी रेडियो न्यूज लखनऊ,सुशील चन्द्र तिवारी आकाशवाणी समाचार लखनऊ,true_duplicate
महिला के खिलाफ अपराध आ भीड़ हिंसा प्रधानमंत्री कहलन कि उनुकर पार्टी एकर सख्ती से खिलाफ बा।,महिलाओं के खिलाफ अपराध और भीड़ हिंसा पर प्रधानमंत्री ने कहा कि उनकी पार्टी इसके सख्त खिलाफ है,true_duplicate
एह कानून में राष्ट्रपति रामनाथ कोविंद अपराध रोकथाम संशोधन अधिनियम 2018 के बारह साल खातिर मंजूरी देले बाड़न।,इस अधिनियम में राष्ट्रपति राम नाथ कोविन्द ने बारह वर्षों के लिए अपराध निवारण संशोधन अधिनियम 2018 को मंजूरी दे दी है,true_duplicate
हालांकि कुछ जगह पर नदियन के पानी कम होखे लागल बा बाकिर कई जिलन के तटीय इलाका में रहे वाला लाखों लोग अबहियो बाढ़ में डूबले बा।,"हालाँकि कुछ स्थानों पर नदियाँ घटने लगी हैं, लेकिन कई जिलों में तटीय क्षेत्रों में रहने वाले लाखों लोग अभी भी बाढ़ में डूबे हुए हैं",true_duplicate
"जिला के करनाइलगंज आ तरबगञ्ज तहसील के 350 से अधिका गाँव के 100,000 से अधिका लोग बाढ़ से पीड़ित बा।","जिले के करनैलगंज और तरबगंज तहसीलों के 350 से अधिक गांवों के 100,000 से अधिक लोग बाढ़ से प्रभावित हैं",true_duplicate
एह चलते सगरी राज्यन में अस्थीकालश यात्रा करे के फैसला लिहल गइल बा।,इसलिए सभी राज्यों में अस्थिकलश यात्रा का निर्णय लिया गया है,true_duplicate
उडान योजना विस्तार केन्द्र अंतरराष्ट्रीय मार्गन पर सस्ता हवाई यात्रा उपलब्ध करावे खातिर एगो मसौदा प्लान जारी कइले बा।,उड़ान योजना विस्तार केंद्र ने अंतरराष्ट्रीय मार्गों पर सस्ती हवाई यात्रा उपलब्ध कराने के लिए एक मसौदा योजना जारी की है,true_duplicate
देश के सामान्य नागरिक उडान योजना लागू हो गई।,देश की सामान्य नागरिक उड़ान योजना लागू की गई,true_duplicate
बलरामपुर जिला के श्रीदत्ता ब्लॉक में राप्ति नदी से नदी किनारे बसे वाला सैकड़न गाँवन में बाढ़ आ गइल बा।,बलरामपुर जिले के श्रीदत्त ब्लॉक में राप्ती नदी से नदी के किनारे बसे सैकड़ों गांवों में बाढ़ आ गई है,true_duplicate
जिला प्रशासन द्वारा एकर मरम्मत जोर शोर से कइल जा रहल बा।,जिला प्रशासन द्वारा इसकी मरम्मत जोर-शोर से करायी जा रही है,true_duplicate
ऊ विदेश में शोध करे वाला प्रतिभाशाली भारतीय विद्यार्थियन के अपना विश्वविद्यालय से शोध खातिर वापस आकर्षित करे के कोशिश करत बाड़े.,वह विदेश में शोध कर रहे प्रतिभाशाली भारतीय छात्रों को अपने विश्वविद्यालयों से शोध के लिए वापस आकर्षित करने का प्रयास कर रहे हैं,true_duplicate
विपक्ष के दंगा का चलते ओही दिन विधानसभा के स्थगित क दिहल गइल.,विपक्ष के हंगामे के कारण विधानसभा उसी दिन स्थगित कर दी गई,true_duplicate
सदन का बाहर मीडिया से बतियावत मुख्यमंत्री योगि आदित्यनाथ कहलन कि विपक्ष का लगे कवनो मुद्दा नइखे.,सदन के बाहर मीडिया से बात करते हुए मुख्यमंत्री योगी आदित्यनाथ ने कहा कि विपक्ष के पास कोई मुद्दा नहीं है,true_duplicate
"उड्डयन मन्त्री सुरेश प्रभू, वातावरण मन्त्री डा. हर्षवर्धन आ नागरिक उड्ययन राज्यमन्त्री जयन्त सिन्हा द्वारा उड़ान के स्वागत कइल गइल ।","श्रीमान उड्डयन मंत्री सुरेश प्रभु, पर्यावरण मंत्री डॉ. हर्ष वर्धन और नागरिक उड्डयन राज्य मंत्री जयंत सिन्हा ने उड़ान का स्वागत किया",true_duplicate
एगो नागरिका रूप में ई सुनिश्चित कइल हमनी के अधिकार आ कर्तव्य दुनु बा कि ई ना खाली हमनी के बा बल्कि हमनी के वाई भी बा।,"एक नागरिक के रूप में यह सुनिश्चित करना हमारा अधिकार और कर्तव्य दोनों है कि यह न केवल हमारा है, बल्कि हमारा वाई भी है एक नागरिक के रूप में यह हमारा अधिकार और कर्तव्य दोनों है, हम यह सुनिश्चित करते हैं कि यह केवल हमारा नहीं है, हमारा वाई भी है, हम यह सुनिश्चित करते हैं यह सिर्फ हमारा ही नहीं, एक नागरिक के तौर पर हम सबका अधिकार और कर्तव्य भी है, यह हम सभी का अधिकार और कर्तव्य भी है, देश के सभी लोगों का नाम मतदाता सूची में होने की भी संभावना है सूची",ratio_too_high
फोन लाइन एह महीना के 26 तारीख ले खुलल रही.,फ़ोन लाइन इस महीने की 26 तारीख तक खुली रहेगी,true_duplicate
सुशील चंद्र तिवारी रेडियो न्यूज लखनऊ,सुशील चन्द्र तिवारी आकाशवाणी समाचार लखनऊ,true_duplicate
दुसरका यम पर्व के मौका पर मथूरा में आजु भारी भीड़ जुटल.,यम द्वितीय पर्व के अवसर पर आज मथुरा में भारी भीड़ उमड़ी,true_duplicate
आजु पूरबी जिलन में औरत आ लड़िका गोबर से यमुना के आकृति बना के उनकर पूजा कइलें आ अपना भाई लोग के दीर्घायु होखे के कामना कइलें।,आज पूर्वी जिलों में महिलाओं और लड़कियों ने गोबर से यम की आकृति बनाकर उनकी पूजा की और अपने भाइयों की लंबी उम्र की कामना की,true_duplicate
मुख्यमंत्री योगि आदित्यनाथ आ उपमुख्यमंत्री केशवप्रसाद मौर्या भाई दूज का मौका पर प्रदेश के लोगन के शुभकामना दिहले बाड़न.,मुख्यमंत्री योगी आदित्यनाथ और उप मुख्यमंत्री केशव प्रसाद मौर्य ने भैया दूज के अवसर पर प्रदेशवासियों को शुभकामनाएं दी हैं,true_duplicate
"एह एन.आर.आई. दिवस क जनक भारत की पूर्व प्रधानमंत्री, भारतरत्न से सम्मानित अटलबिहारी वाजपेई क स्मृति हवे।","इस एनआरआई दिवस के जनक भारत के पूर्व प्रधानमंत्री, भारत रत्न से सम्मानित अटल बिहारी वाजपेयी की स्मृति हैं इस एनआरआई दिवस के जनक भारत के पूर्व प्रधान मंत्री, भारत रत्न से सम्मानित अटल बिहारी वाजपेयी की स्मृति हैं इस एनआरआई दिवस के जनक, भारत के पूर्व प्रधान मंत्री, भारत रत्न से सम्मानित अटल बिहारी वाजपेयी की स्मृति",ratio_too_high
घवाहिलन के इलाज खातिर अस्पताल में भरती करावल गइल बा.,घायलों को इलाज के लिए अस्पताल में भर्ती कराया गया है,true_duplicate
सुशील चंद्र तिवारी रेडियो न्यूज लखनऊ,सुशील चन्द्र तिवारी आकाशवाणी समाचार लखनऊ,true_duplicate
एगो ट्वीट में प्रधानमंत्री लोग से नरेन्द्र मोदी एप आ माईजीओवी खुला मंच पर आपन विचार आ सुझाव साझा करे के आग्रह कइले.,"एक ट्वीट संदेश में, प्रधान मंत्री ने लोगों से नरेंद्र मोदी ऐप और माई जीओवी ओपन फोरम पर अपने विचार और सुझाव साझा करने का आग्रह किया",true_duplicate
लोग आपन सन्देश टोल फ्री नम्बर एक आठ सुन सुन एक एगो सात आठ सुन सुन पर भेज सकत बा,लोग अपना संदेश टोल फ्री नंबर एक आठ सुन्न सुन्न एक एक सात आठ सुन्न सुन्न पर भेज सकते हैं,true_duplicate
घवाहिलन के इलाज खातिर अस्पताल में भरती करावल गइल बा.,घायलों को इलाज के लिए अस्पताल में भर्ती कराया गया है,true_duplicate
Multan Singh Yadav आकाशवाणी न्यूज लखनऊ,मुल्तान सिंह यादव आकाशवाणी समाचार लखनऊ,true_duplicate
ई फैसला आजु मुख्यमंत्री योगि आदित्यनाथ के अध्यक्षता में भइल मंत्रिमंडल के बइठक में लिहल गइल.,यह फैसला आज मुख्यमंत्री योगी आदित्यनाथ की अध्यक्षता में हुई कैबिनेट बैठक में लिया गया,true_duplicate
घवाहिलन के अस्पताल में भरती करावल गइल बा.,घायलों को अस्पताल में भर्ती कराया गया है,true_duplicate
घवाहिलन के जिला अस्पताल में भरती करावल गइल बा.,घायलों को जिला अस्पताल में भर्ती कराया गया है,true_duplicate
चुनाव आयोग राजनीतिक दल आ उम्मीदवारन के चुनाव खर्च के निगरानी खातिर विस्तृत दिशा निर्देश जारी कइले बा.,आयोग ने राजनीतिक दलों और उम्मीदवारों के चुनाव खर्च की निगरानी के लिए विस्तृत दिशानिर्देश जारी किए हैं,true_duplicate
"बेशक, फागुन शुक्ल एकदशी, रंगाई वाला एकदशी रंग के त्योहार होली या काशी के शुरुआत के प्रतीक बा, जवना में मंदिर से सड़कन आ घर से कब्रस्तान ले अबिरगुलाल उड़त बाड़े।","बेशक, फागुन शुक्ल एकादशी, रंगीन एकादशी, रंगों के त्योहार होली या काशी की शुरुआत का प्रतीक है, जिसमें मंदिरों से सड़कों और घरों से कब्रिस्तानों तक अबीरगुलाल उड़ते हैं",true_duplicate
सुशील चंद्र तिवारी रेडियो न्यूज लखनऊ,सुशील चन्द्र तिवारी आकाशवाणी समाचार लखनऊ,true_duplicate
नामांकन के अंतिम दिन सवा सोलह गो उम्मीदवार आपन नामांकन दाखिल कइलें।,नामांकन के आखिरी दिन एक सौ सोलह उम्मीदवारों ने अपना नामांकन पत्र दाखिल किया,true_duplicate
नामांकन के जाँच अप्रैल में कइल जाई।,अप्रैल को नामांकन की जांच होगी,true_duplicate
"ई शहरन में महराजगञ्ज, गोरखापुर, कुशीनगर, देवरिया, बांसगँउ, घासी, सलीमपुर, बलिया, गाज़ीपुर, चन्दौली, बनारस, मिर्जापुर आ राबटरगंज शामिल बा।","ये शहर हैं महराजगंज, गोरखपुर, कुशीनगर, देवरिया, बांसगांव, घोसी, सलेमपुर, बलिया, गाजीपुर, चंदौली, वाराणसी, मीरजापुर और राबटर्सगंज",true_duplicate
"ई शहरन में महराजगञ्ज, गोरखापुर, कुशीनगर, देवरिया, बांसगँउ, घासी, सलीमपुर, बलिया, गाज़ीपुर, चन्दौली, बनारस, मिर्जापुर आ राबटरगंज शामिल बा।","ये शहर हैं महराजगंज, गोरखपुर, कुशीनगर, देवरिया, बांसगांव, घोसी, सलेमपुर, बलिया, गाजीपुर, चंदौली, वाराणसी, मीरजापुर और राबटर्सगंज",true_duplicate
दिन भर जवानन के मतदान जारी रहल,पूरे दिन युवाओं का मतदान जारी रहा,true_duplicate
कुछ जगहा ईवीएम में खराबी के खबर आइल जवना के चुनाव अधिकारी तुरते ठीक कर लिहलें।,कुछ जगहों पर ईवीएम मशीनों में खराबी की खबरें आईं जिन्हें चुनाव अधिकारियों ने तुरंत ठीक कर लिया,true_duplicate
चुनाव आयोग दिव्यांगजन आ महिला मतदाता खातिर मतदान केन्द्रन पर विशेष व्यवस्था कइले रहे।,चुनाव आयोग ने मतदान केंद्रों पर दिव्यांगों और महिला मतदाताओं के लिए विशेष व्यवस्था की थी,true_duplicate
हम आकाशवाणी समाचार खातिर लखनऊ के मुलतन सिंह यादव हईं।,मैं आकाशवाणी समाचार के लिए लखनऊ से मुल्तान सिंह यादव हूं,true_duplicate
एह कार्यक्रम के ऑल इण्डिया रेडियो के एफ एम गोल्ड आ अन्य चैनल पर सुनल जा सकेला।,कार्यक्रम को ऑल इंडिया रेडियो के एफएम गोल्ड और अन्य चैनलों पर सुना जा सकता है,true_duplicate
तेज गरम हवा के बीच तापमान बढ़ला से लोगन के जीवन अस्तव्यस्त हो गइल बा।,तेज गर्म हवाओं के बीच तापमान में बढ़ोतरी ने लोगों का जीवन अस्त-व्यस्त कर दिया है,true_duplicate
बाद में प्रधानमंत्री अपना कैबिनेट के सदस्यन के सदन से परिचित करवले.,बाद में प्रधानमंत्री ने अपने मंत्रिमंडल के सदस्यों का सदन से परिचय कराया,true_duplicate
"एगो ट्वीट संदेश में प्रधानमंत्री कहलन कि ऊ आ देशवासी एक बेर फेरु रेडियो का जरिये सकारात्मकता आ उत्साह साझा करीहें, 130 करोड़ भारतीयन के सामूहिक ताकत के प्रदर्शन करीहें।","एक ट्वीट संदेश में, प्रधान मंत्री ने कहा कि वह और देशवासी एक बार फिर रेडियो के माध्यम से सकारात्मकता और उत्साह साझा करेंगे, 130 करोड़ भारतीयों की सामूहिक शक्ति का प्रदर्शन करेंगे",true_duplicate
प्रधानमंत्री कहलन कि ऊ विचार आदान प्रदान के बड़हन संभावना देखत बाड़न.,प्रधानमंत्री ने कहा कि वह विचारों के व्यापक आदान-प्रदान की आशा करते हैं,true_duplicate
लोग एस एम एस के जरिए दिहल गइल लिंक पर एगो नौ दू दू नंबर पर मिस कॉल के आपन सुझाव सीधे प्रधानमंत्री के भेज सकेला।,लोग एसएमएस द्वारा दिए गए लिंक पर एक नौ दो दो नंबर पर मिस्ड कॉल करके अपने सुझाव सीधे प्रधानमंत्री को भेज सकते हैं,true_duplicate
लोग एस एम एस के जरिए दिहल गइल लिंक पर एगो नौ दू दू नंबर पर मिस कॉल के आपन सुझाव सीधे प्रधानमंत्री के भेज सकेला।,लोग एसएमएस द्वारा दिए गए लिंक पर एक नौ दो दो नंबर पर मिस्ड कॉल करके अपने सुझाव सीधे प्रधानमंत्री को भेज सकते हैं,true_duplicate
